{
  "$schema": "https://raw.githubusercontent.com/AllenNeuralDynamics/openscope-params/main/tooling/model_launcher.schema.json",
  "launcher_version": ">=0.2.7",
  "launcher": "base",
  "subject_id": "mouse123",
  "user_id": "tester",
  "session_sync_role": "master",
  "session_sync_port": 47001,
  "session_sync_expected_slaves": 1,
  "session_sync_bind_host": "127.0.0.1"
}
